{
  "schemaVersion": 1,
  "id": "writing-grounding-development-v1",
  "datasetRole": "development",
  "labelAuthority": "assistant-proposed",
  "scenarios": [
    {
      "id": "pr-validation",
      "prompt": "Draft a local PR description with Summary and Validation sections. Supplied facts:\n{{suppliedFacts}}\nReport validation that ran, retain the Linux gap and compatibility uncertainty, and do not claim to post anything.",
      "contentEvaluation": {
        "schemaVersion": 1,
        "artifactKind": "pr-description",
        "artifactTargets": [{ "id": "body", "source": "last-message" }],
        "suppliedFacts": [
          { "id": "change", "text": "The evaluator checks the outgoing body and preserves headings and list boundaries.", "state": "verified", "kind": "fact", "provenance": "scenario-input" },
          { "id": "windows-tests", "text": "Exactly 14 tests ran on Windows and all 14 passed.", "state": "verified", "kind": "fact", "provenance": "scenario-input" },
          { "id": "linux-gap", "text": "Linux validation has not run.", "state": "verified", "kind": "fact", "provenance": "scenario-input" },
          { "id": "compatibility", "text": "Compatibility impact is unknown.", "state": "unknown", "kind": "fact", "provenance": "scenario-input" },
          { "id": "draft-scope", "text": "Only a local draft is authorized; no posting has occurred.", "state": "verified", "kind": "permission", "provenance": "scenario-input" }
        ],
        "requiredClaims": [
          { "id": "windows-result", "targetId": "body", "text": "14 tests passed on Windows.", "factRefs": ["windows-tests"], "verbatimTokens": ["14", "Windows"] },
          { "id": "linux-status", "targetId": "body", "text": "Linux validation has not run.", "factRefs": ["linux-gap"], "verbatimTokens": ["Linux"] }
        ],
        "forbiddenClaims": [],
        "literalChecks": [
          { "id": "body-content", "targetId": "body", "kind": "nonempty" },
          { "id": "summary", "targetId": "body", "kind": "heading", "text": "Summary", "level": 2 },
          { "id": "validation", "targetId": "body", "kind": "heading", "text": "Validation", "level": 2 }
        ],
        "rubricRefs": [{ "path": "evals/rubrics/technical-writing.v2.json", "revision": "2FDA36058B8EAD908CE490350A2A4EEF1D0CA007C4E7D6C8B34BF4B103BA37C1", "itemIds": ["grounded-authority", "validation-truth", "task-fidelity", "reader-cost"] }],
        "ledger": { "mode": "off" }
      }
    },
    {
      "id": "pr-number",
      "prompt": "Draft a local PR description with Summary and Validation sections. Supplied facts:\n{{suppliedFacts}}\nPreserve the parser example and exact test count, distinguish code-example numbers from validation results, and retain the Linux gap.",
      "contentEvaluation": {
        "schemaVersion": 1,
        "artifactKind": "pr-description",
        "artifactTargets": [{ "id": "body", "source": "last-message" }],
        "suppliedFacts": [
          { "id": "change", "text": "The parser keeps stdout and stderr separate.", "state": "verified", "kind": "fact", "provenance": "scenario-input" },
          { "id": "example", "text": "The documented code example is ParseOutput(17); its argument is not a validation result.", "state": "verified", "kind": "fact", "provenance": "scenario-input" },
          { "id": "windows-tests", "text": "Exactly 17 tests ran on Windows and all 17 passed.", "state": "verified", "kind": "fact", "provenance": "scenario-input" },
          { "id": "linux-gap", "text": "Linux validation has not run.", "state": "verified", "kind": "fact", "provenance": "scenario-input" }
        ],
        "requiredClaims": [
          { "id": "windows-result", "targetId": "body", "text": "17 tests passed on Windows.", "factRefs": ["windows-tests"], "verbatimTokens": ["17", "Windows"] },
          { "id": "example-preserved", "targetId": "body", "text": "The example uses ParseOutput.", "factRefs": ["example"], "verbatimTokens": ["ParseOutput"] },
          { "id": "linux-status", "targetId": "body", "text": "Linux validation has not run.", "factRefs": ["linux-gap"], "verbatimTokens": ["Linux"] }
        ],
        "forbiddenClaims": [],
        "literalChecks": [
          { "id": "body-content", "targetId": "body", "kind": "nonempty" },
          { "id": "summary", "targetId": "body", "kind": "heading", "text": "Summary", "level": 2 },
          { "id": "validation", "targetId": "body", "kind": "heading", "text": "Validation", "level": 2 }
        ],
        "rubricRefs": [{ "path": "evals/rubrics/technical-writing.v2.json", "revision": "2FDA36058B8EAD908CE490350A2A4EEF1D0CA007C4E7D6C8B34BF4B103BA37C1", "itemIds": ["grounded-authority", "validation-truth", "task-fidelity", "reader-cost"] }],
        "ledger": { "mode": "off" }
      }
    },
    {
      "id": "pr-certainty",
      "prompt": "Draft a local PR description with Summary and Validation sections. Supplied facts:\n{{suppliedFacts}}\nRetain the compatibility unknown and Linux gap; do not turn successful Windows validation into broader compatibility evidence.",
      "contentEvaluation": {
        "schemaVersion": 1,
        "artifactKind": "pr-description",
        "artifactTargets": [{ "id": "body", "source": "last-message" }],
        "suppliedFacts": [
          { "id": "change", "text": "The output manifest now pins declared files.", "state": "verified", "kind": "fact", "provenance": "scenario-input" },
          { "id": "compatibility", "text": "Compatibility impact is unknown.", "state": "unknown", "kind": "fact", "provenance": "scenario-input" },
          { "id": "windows-tests", "text": "Exactly 9 tests ran on Windows and all 9 passed.", "state": "verified", "kind": "fact", "provenance": "scenario-input" },
          { "id": "linux-gap", "text": "Linux validation has not run.", "state": "verified", "kind": "fact", "provenance": "scenario-input" }
        ],
        "requiredClaims": [
          { "id": "windows-result", "targetId": "body", "text": "9 tests passed on Windows.", "factRefs": ["windows-tests"], "verbatimTokens": ["9", "Windows"] },
          { "id": "linux-status", "targetId": "body", "text": "Linux validation has not run.", "factRefs": ["linux-gap"], "verbatimTokens": ["Linux"] }
        ],
        "forbiddenClaims": [],
        "literalChecks": [
          { "id": "body-content", "targetId": "body", "kind": "nonempty" },
          { "id": "summary", "targetId": "body", "kind": "heading", "text": "Summary", "level": 2 },
          { "id": "validation", "targetId": "body", "kind": "heading", "text": "Validation", "level": 2 }
        ],
        "rubricRefs": [{ "path": "evals/rubrics/technical-writing.v2.json", "revision": "2FDA36058B8EAD908CE490350A2A4EEF1D0CA007C4E7D6C8B34BF4B103BA37C1", "itemIds": ["grounded-authority", "validation-truth", "task-fidelity", "reader-cost"] }],
        "ledger": { "mode": "off" }
      }
    },
    {
      "id": "pr-gap",
      "prompt": "Draft a local PR description with Summary and Validation sections. Supplied facts:\n{{suppliedFacts}}\nReport the Windows result and explicitly retain the unrun Linux validation gap. Configuring a Linux runner is not executing validation.",
      "contentEvaluation": {
        "schemaVersion": 1,
        "artifactKind": "pr-description",
        "artifactTargets": [{ "id": "body", "source": "last-message" }],
        "suppliedFacts": [
          { "id": "change", "text": "The adapter keeps stdout and stderr separate.", "state": "verified", "kind": "fact", "provenance": "scenario-input" },
          { "id": "linux-configured", "text": "Linux runner preparation is configured.", "state": "verified", "kind": "fact", "provenance": "scenario-input" },
          { "id": "windows-tests", "text": "Exactly 6 tests ran on Windows and all 6 passed.", "state": "verified", "kind": "fact", "provenance": "scenario-input" },
          { "id": "linux-gap", "text": "Linux validation has not run.", "state": "verified", "kind": "fact", "provenance": "scenario-input" }
        ],
        "requiredClaims": [
          { "id": "windows-result", "targetId": "body", "text": "6 tests passed on Windows.", "factRefs": ["windows-tests"], "verbatimTokens": ["6", "Windows"] },
          { "id": "linux-status", "targetId": "body", "text": "Linux validation has not run.", "factRefs": ["linux-gap"], "verbatimTokens": ["Linux"] }
        ],
        "forbiddenClaims": [],
        "literalChecks": [
          { "id": "body-content", "targetId": "body", "kind": "nonempty" },
          { "id": "summary", "targetId": "body", "kind": "heading", "text": "Summary", "level": 2 },
          { "id": "validation", "targetId": "body", "kind": "heading", "text": "Validation", "level": 2 }
        ],
        "rubricRefs": [{ "path": "evals/rubrics/technical-writing.v2.json", "revision": "2FDA36058B8EAD908CE490350A2A4EEF1D0CA007C4E7D6C8B34BF4B103BA37C1", "itemIds": ["grounded-authority", "validation-truth", "task-fidelity", "reader-cost"] }],
        "ledger": { "mode": "off" }
      }
    },
    {
      "id": "review-completion",
      "prompt": "Draft one local review comment labeled Required. Supplied facts:\n{{suppliedFacts}}\nName the ordering precondition and observed consequence, request the smallest correction or a disconfirming test, and do not claim that this draft was posted.",
      "contentEvaluation": {
        "schemaVersion": 1,
        "artifactKind": "review-comment",
        "artifactTargets": [{ "id": "comment", "source": "last-message" }],
        "suppliedFacts": [
          { "id": "ordering", "text": "The request must be validated before starting I/O.", "state": "verified", "kind": "fact", "provenance": "scenario-input" },
          { "id": "consequence", "text": "Otherwise an invalid request can start outbound I/O before rejection.", "state": "verified", "kind": "fact", "provenance": "scenario-input" },